{
  "$schema": "https://raw.githubusercontent.com/davidsteimer/fristenrechner/main/schemas/source-register.schema.json",
  "formatVersion": "1.0.0",
  "dataKind": "sourceRegister",
  "registerId": "ch-be-mvp-source-register",
  "registerStatus": "candidate",
  "createdOn": "2026-08-31",
  "responsible": "David Steimer",
  "scope": {
    "jurisdictions": [
      "CH",
      "BE"
    ],
    "productiveReleaseIds": [
      "2026-08-31-mvp-02-approved.1",
      "2026-08-31-mvp-03-approved.1",
      "2026-09-22-mvp-04-approved.1"
    ]
  },
  "sources": [
    {
      "sourceId": "JUD-AP17C-BGER-8C-767-2008-20090112",
      "usageStatus": "productive",
      "sourceType": "caseLaw",
      "title": "BGER-8C-767-2008, AP17C-Quellenkette",
      "authority": "Bundesgericht",
      "jurisdiction": "CH",
      "officialLocator": "BGER-8C-767-2008, AP17C-Quellenkette",
      "officialUrl": "https://search.bger.ch/ext/eurospider/live/fr/php/aza/http/index.php?azaclir=aza&from_date=&highlight_docid=aza%3A%2F%2F12-01-2009-8C_767-2008&insertion_date=&lang=fr&number_of_ranks=30&page=1&query_words=8C_767%2F2008&rank=1&sort=relevance&to_date=&top_subcollection_aza=all&type=highlight_simple_query",
      "retrievalUrl": "https://mcp.opencaselaw.ch/entscheid/bger_8C_767_2008#e-4-3-2",
      "documentVersionDate": "2009-01-12",
      "subjectAreas": [
        "specialRegimes"
      ],
      "relevantProvisions": [
        "BGer 8C_767/2008 vom 12. Januar 2009 E. 4.3.1 und 4.3.2",
        "E. 4.3.2, ergänzend E. 4.3.1"
      ]
    },
    {
      "sourceId": "JUD-AP17C-VGER-BE-100-2024-8-20240404",
      "usageStatus": "productive",
      "sourceType": "caseLaw",
      "title": "VGER-BE-100-2024-8, AP17C-Quellenkette",
      "authority": "Verwaltungsgericht des Kantons Bern",
      "jurisdiction": "BE",
      "officialLocator": "VGER-BE-100-2024-8, AP17C-Quellenkette",
      "officialUrl": null,
      "retrievalUrl": "https://entscheidsuche.ch/docs/BE_Verwaltungsgericht/BE_VG_001_100-2024-8_2024-04-04.pdf",
      "documentVersionDate": "2024-04-04",
      "subjectAreas": [
        "specialRegimes"
      ],
      "relevantProvisions": [
        "VGer BE 100.2024.8U vom 4. April 2024 E. 1.1 und 2",
        "E. 1.1, S. 4 bis 5. Ergänzend E. 2, S. 5 bis 6"
      ]
    },
    {
      "sourceId": "JUD-AP17C-VGER-BE-200-2017-814-20180117",
      "usageStatus": "productive",
      "sourceType": "caseLaw",
      "title": "VGER-BE-200-2017-814, AP17C-Quellenkette",
      "authority": "Verwaltungsgericht des Kantons Bern",
      "jurisdiction": "BE",
      "officialLocator": "VGER-BE-200-2017-814, AP17C-Quellenkette",
      "officialUrl": null,
      "retrievalUrl": "https://mcp.opencaselaw.ch/entscheid/be_verwaltungsgericht_200_2017_814#e-1-2",
      "documentVersionDate": "2018-01-17",
      "subjectAreas": [
        "specialRegimes"
      ],
      "relevantProvisions": [
        "VGer BE 200.2017.814 vom 17. Januar 2018 E. 1.2",
        "E. 1.2, S. 3 bis 4, insbesondere S. 4"
      ]
    },
    {
      "sourceId": "JUD-BE-VG-100-2016-347",
      "usageStatus": "productive",
      "sourceType": "caseLaw",
      "title": "VGer BE 100.2016.347U vom 29. Juni 2017, BVR 2017 S. 459",
      "authority": "Verwaltungsgericht des Kantons Bern",
      "jurisdiction": "BE",
      "officialLocator": "VGer BE 100.2016.347U vom 29. Juni 2017, BVR 2017 S. 459",
      "officialUrl": null,
      "retrievalUrl": "https://entscheidsuche.ch/docs/BE_Verwaltungsgericht/BE_VG_001_100-2016-347_2017-06-29.pdf",
      "documentVersionDate": "2017-06-29",
      "subjectAreas": [
        "specialRegimes"
      ],
      "relevantProvisions": [
        "Art. 67a Abs. 3 VRPG"
      ]
    },
    {
      "sourceId": "JUD-BE-VG-100-2017-270",
      "usageStatus": "productive",
      "sourceType": "caseLaw",
      "title": "VGer BE 100.2017.270 vom 12. Dezember 2017",
      "authority": "Verwaltungsgericht des Kantons Bern",
      "jurisdiction": "BE",
      "officialLocator": "VGer BE 100.2017.270 vom 12. Dezember 2017",
      "officialUrl": null,
      "retrievalUrl": "https://entscheidsuche.ch/docs/BE_Verwaltungsgericht/BE_VG_001_100-2017-270_2017-12-12.pdf",
      "documentVersionDate": "2017-12-12",
      "subjectAreas": [
        "specialRegimes"
      ],
      "relevantProvisions": [
        "Art. 67a Abs. 3 VRPG"
      ]
    },
    {
      "sourceId": "JUD-BE-VG-100-2021-109",
      "usageStatus": "supporting",
      "sourceType": "caseLaw",
      "title": "VGer BE 100.2021.109U vom 31. August 2021",
      "authority": "Verwaltungsgericht des Kantons Bern",
      "jurisdiction": "BE",
      "officialLocator": "VGer BE 100.2021.109U vom 31. August 2021",
      "officialUrl": null,
      "retrievalUrl": "https://entscheidsuche.ch/docs/BE_Verwaltungsgericht/BE_VG_001_100-2021-109_2021-08-31.pdf",
      "documentVersionDate": "2021-08-31",
      "subjectAreas": [
        "deadlineEnd",
        "specialRegimes"
      ],
      "relevantProvisions": [
        "Art. 41 Abs. 2 VRPG"
      ]
    },
    {
      "sourceId": "JUD-BE-VG-100-2021-189",
      "usageStatus": "productive",
      "sourceType": "caseLaw",
      "title": "VGer BE 100.2021.189U vom 22. Oktober 2021, BVR 2022 S. 5",
      "authority": "Verwaltungsgericht des Kantons Bern",
      "jurisdiction": "BE",
      "officialLocator": "VGer BE 100.2021.189U vom 22. Oktober 2021, BVR 2022 S. 5",
      "officialUrl": null,
      "retrievalUrl": "https://mcp.opencaselaw.ch/entscheid/be_verwaltungsgericht_100_2021_189",
      "documentVersionDate": "2021-10-22",
      "subjectAreas": [
        "specialRegimes"
      ],
      "relevantProvisions": [
        "Art. 67a Abs. 3 VRPG"
      ]
    },
    {
      "sourceId": "JUD-BE-VG-200-2026-421",
      "usageStatus": "productive",
      "sourceType": "caseLaw",
      "title": "VGer BE SH 200 2026 421 vom 26. Juni 2026",
      "authority": "Verwaltungsgericht des Kantons Bern",
      "jurisdiction": "BE",
      "officialLocator": "VGer BE SH 200 2026 421 vom 26. Juni 2026",
      "officialUrl": null,
      "retrievalUrl": "https://entscheidsuche.ch/docs/BE_Verwaltungsgericht/BE_VG_001_200-2026-421_2026-06-26.pdf",
      "documentVersionDate": "2026-06-26",
      "subjectAreas": [
        "deadlineEnd",
        "publicHolidays"
      ],
      "relevantProvisions": [
        "Art. 41 Abs. 2 VRPG"
      ]
    },
    {
      "sourceId": "JUD-BGER-1C-275-2009",
      "usageStatus": "productive",
      "sourceType": "caseLaw",
      "title": "BGer 1C_275/2009 vom 1. Oktober 2009",
      "authority": "Bundesgericht",
      "jurisdiction": "CH",
      "officialLocator": "BGer 1C_275/2009, E. 3.3.2",
      "officialUrl": "https://search.bger.ch/ext/eurospider/live/de/php/aza/http/index.php?azaclir=aza&highlight_docid=aza%3A%2F%2F01-10-2009-1C_275-2009&lang=de&type=highlight_simple_query",
      "retrievalUrl": "https://search.bger.ch/ext/eurospider/live/de/php/aza/http/index.php?azaclir=aza&highlight_docid=aza%3A%2F%2F01-10-2009-1C_275-2009&lang=de&type=highlight_simple_query",
      "documentVersionDate": "2009-10-01",
      "subjectAreas": [
        "deadlineEnd",
        "specialRegimes"
      ],
      "relevantProvisions": [
        "Art. 77 Abs. 1 und Art. 79 BPR"
      ]
    },
    {
      "sourceId": "JUD-BGER-1C-592-2025",
      "usageStatus": "supporting",
      "sourceType": "caseLaw",
      "title": "BGer 1C_592/2025 vom 27. Februar 2026",
      "authority": "Bundesgericht",
      "jurisdiction": "CH",
      "officialLocator": "BGer 1C_592/2025 vom 27. Februar 2026",
      "officialUrl": "https://search.bger.ch/ext/eurospider/live/de/php/aza/http/index.php?highlight_docid=aza%3A%2F%2F27-02-2026-1C_592-2025&lang=de&type=show_document&zoom=",
      "retrievalUrl": "https://search.bger.ch/ext/eurospider/live/de/php/aza/http/index.php?highlight_docid=aza%3A%2F%2F27-02-2026-1C_592-2025&lang=de&type=show_document&zoom=",
      "documentVersionDate": "2026-02-27",
      "subjectAreas": [
        "delivery",
        "amendmentMonitoring"
      ],
      "relevantProvisions": [
        "Zustellungspraxis A-Post Plus"
      ]
    },
    {
      "sourceId": "JUD-BGER-8C-620-2007",
      "usageStatus": "productive",
      "sourceType": "caseLaw",
      "title": "BGer 8C_620/2007 vom 9. Juni 2008",
      "authority": "Bundesgericht",
      "jurisdiction": "CH",
      "officialLocator": "BGer 8C_620/2007, E. 3.3",
      "officialUrl": "https://www.bger.ch/ext/eurospider/live/de/php/aza/http/index.php?lang=de&type=show_document&highlight_docid=aza://09-06-2008-8C_620-2007",
      "retrievalUrl": "https://www.bger.ch/ext/eurospider/live/de/php/aza/http/index.php?lang=de&type=show_document&highlight_docid=aza://09-06-2008-8C_620-2007",
      "documentVersionDate": "2008-06-09",
      "subjectAreas": [
        "specialRegimes"
      ],
      "relevantProvisions": [
        "Art. 41 Abs. 3 VRPG"
      ]
    },
    {
      "sourceId": "JUD-BGER-9C-757-2007",
      "usageStatus": "productive",
      "sourceType": "caseLaw",
      "title": "BGer 9C_757/2007 vom 3. Januar 2008",
      "authority": "Bundesgericht",
      "jurisdiction": "CH",
      "officialLocator": "BGer 9C_757/2007, E. 3",
      "officialUrl": "https://www.bger.ch/ext/eurospider/live/de/php/aza/http/index.php?lang=de&type=show_document&highlight_docid=aza://03-01-2008-9C_757-2007",
      "retrievalUrl": "https://www.bger.ch/ext/eurospider/live/de/php/aza/http/index.php?lang=de&type=show_document&highlight_docid=aza://03-01-2008-9C_757-2007",
      "documentVersionDate": "2008-01-03",
      "subjectAreas": [
        "specialRegimes"
      ],
      "relevantProvisions": [
        "Art. 41 Abs. 3 VRPG"
      ]
    },
    {
      "sourceId": "SRC-AP17C-AHVG-20260101",
      "usageStatus": "productive",
      "sourceType": "statute",
      "title": "AHVG, AP17C-Quellenkette",
      "authority": "Schweizerische Eidgenossenschaft",
      "jurisdiction": "CH",
      "officialLocator": "AHVG, AP17C-Quellenkette",